{
  "schema_version": 2,
  "source": {
    "path": "catalog/tools.yml",
    "sha256": "dadf220adac9fc4d065a248de216e047c63d3b0e162c0f9069504e85bb21fb1a",
    "schema": "schema/catalog.v2.schema.json"
  },
  "categories": [
    {
      "id": "github-mcp-connectors",
      "name": "GitHub MCP / Connectors",
      "order": 1
    },
    {
      "id": "github-cli-and-api",
      "name": "GitHub CLI and API",
      "order": 2
    },
    {
      "id": "gh-extensions",
      "name": "gh Extensions",
      "order": 3
    },
    {
      "id": "agentic-workflows",
      "name": "Agentic Workflows",
      "order": 4
    },
    {
      "id": "browser-and-testing-mcp",
      "name": "Browser and Testing MCP",
      "order": 5
    },
    {
      "id": "code-intelligence-mcp",
      "name": "Code Intelligence MCP",
      "order": 6
    },
    {
      "id": "docs-and-knowledge-mcp",
      "name": "Docs and Knowledge MCP",
      "order": 7
    },
    {
      "id": "formal-proof-lean-support",
      "name": "Formal Proof / Lean support",
      "order": 8
    },
    {
      "id": "git-tui",
      "name": "Git TUI",
      "order": 9
    },
    {
      "id": "git-diff-and-repo-utilities",
      "name": "Git Diff and Repo Utilities",
      "order": 10
    },
    {
      "id": "legacy-avoid",
      "name": "Legacy / Avoid",
      "order": 11
    }
  ],
  "tools": [
    {
      "id": "github-mcp-server",
      "name": "GitHub MCP Server",
      "repo": "github/github-mcp-server",
      "url": "https://github.com/github/github-mcp-server",
      "kind": "mcp",
      "category_id": "github-mcp-connectors",
      "category": "GitHub MCP / Connectors",
      "summary": "Official GitHub MCP server for repository, issue, pull request, workflow, project, org, and gist access from AI agents.",
      "ratings": {
        "agent": "high",
        "human": "medium",
        "risk": "high",
        "status": "recommended"
      },
      "install": {
        "display": "codex mcp add github --url https://api.githubcopilot.com/mcp/ --bearer-token-env-var GITHUB_PAT_TOKEN",
        "methods": [
          {
            "kind": "codex-mcp",
            "command": "codex mcp add github --url https://api.githubcopilot.com/mcp/ --bearer-token-env-var GITHUB_PAT_TOKEN"
          }
        ]
      },
      "practical": {
        "best_for": [
          "agent-github-api",
          "issues-prs",
          "workflow-readback"
        ],
        "daily_use": "reviewed",
        "agent_use": "Let an agent inspect and update GitHub repository, issue, pull request, workflow, project, org, or gist state when the task explicitly needs GitHub context.",
        "human_use": "Use through an agent when GitHub state needs exact readback or controlled repository actions.",
        "cautious_start": "Start with the narrowest available token scope or read-only toolset before allowing write operations.",
        "guardrails": [
          "limited-token",
          "read-only-mode",
          "human-approval"
        ],
        "pairs_with": [
          {
            "tool_id": "github-cli",
            "reason": "Use gh for exact REST or GraphQL fallback and auditable commands.",
            "combined_risk": "high"
          },
          {
            "tool_id": "serena",
            "reason": "Combine GitHub state with project-scoped code navigation.",
            "combined_risk": "high"
          },
          {
            "tool_id": "context7",
            "reason": "Fetch current docs before changing dependency-sensitive code.",
            "combined_risk": "high"
          }
        ]
      },
      "notes": "Use targeted toolsets or read-only mode when broad write access is unnecessary.",
      "evidence": [
        {
          "type": "official_repo",
          "url": "https://github.com/github/github-mcp-server"
        }
      ]
    },
    {
      "id": "github-cli",
      "name": "GitHub CLI",
      "repo": "cli/cli",
      "url": "https://github.com/cli/cli",
      "kind": "cli",
      "category_id": "github-cli-and-api",
      "category": "GitHub CLI and API",
      "summary": "Official GitHub command line interface for issues, pull requests, Actions, releases, rulesets, API calls, and authenticated automation.",
      "ratings": {
        "agent": "high",
        "human": "high",
        "risk": "medium",
        "status": "recommended"
      },
      "install": {
        "display": "brew install gh",
        "methods": [
          {
            "kind": "homebrew",
            "command": "brew install gh"
          }
        ]
      },
      "practical": {
        "best_for": [
          "github-api",
          "pr-review",
          "actions-readback",
          "release-workflows"
        ],
        "daily_use": "routine",
        "agent_use": "Use for auditable GitHub operations, exact API calls, and PR/check readback when connector coverage is insufficient.",
        "human_use": "Use as the baseline command line for issues, pull requests, Actions, releases, and authenticated automation.",
        "cautious_start": "Authenticate with the minimum scopes needed for the current repository or organization task.",
        "guardrails": [
          "limited-token",
          "human-approval"
        ],
        "pairs_with": [
          {
            "tool_id": "lazygit",
            "reason": "Use gh for GitHub state and lazygit for local branch and commit work.",
            "combined_risk": "medium"
          },
          {
            "tool_id": "delta",
            "reason": "Use delta to make gh checkout and local review diffs easier to inspect.",
            "combined_risk": "medium"
          },
          {
            "tool_id": "github-mcp-server",
            "reason": "Use gh as an auditable fallback for agent-facing GitHub MCP flows.",
            "combined_risk": "high"
          }
        ]
      },
      "notes": "Prefer gh api for exact REST or GraphQL operations that are not exposed by a connector or MCP tool; treat gh skill as a gh capability rather than a separate tool entry.",
      "evidence": [
        {
          "type": "official_repo",
          "url": "https://github.com/cli/cli"
        }
      ]
    },
    {
      "id": "gh-dash",
      "name": "gh-dash",
      "repo": "dlvhdr/gh-dash",
      "url": "https://github.com/dlvhdr/gh-dash",
      "kind": "gh-extension",
      "category_id": "gh-extensions",
      "category": "gh Extensions",
      "summary": "Terminal dashboard for GitHub pull requests, issues, custom sections, custom actions, and keyboard-driven triage.",
      "ratings": {
        "agent": "low",
        "human": "high",
        "risk": "medium",
        "status": "situational"
      },
      "install": {
        "display": "gh extension install dlvhdr/gh-dash",
        "methods": [
          {
            "kind": "gh-extension",
            "command": "gh extension install dlvhdr/gh-dash"
          }
        ]
      },
      "practical": {
        "best_for": [
          "human-triage",
          "pr-queues",
          "issue-queues"
        ],
        "daily_use": "reviewed",
        "agent_use": "Low fit for autonomous agents; treat as a human-facing queue dashboard.",
        "human_use": "Use for keyboard-driven PR and issue triage when a terminal dashboard improves review flow.",
        "cautious_start": "Install only after reviewing third-party extension trust and terminal UI assumptions for the team.",
        "guardrails": [
          "human-approval"
        ],
        "pairs_with": [
          {
            "tool_id": "github-cli",
            "reason": "gh remains the underlying authenticated GitHub control plane.",
            "combined_risk": "medium"
          },
          {
            "tool_id": "lazygit",
            "reason": "Use gh-dash for queues and lazygit for local branch/diff workflows.",
            "combined_risk": "medium"
          }
        ]
      },
      "notes": "Great for human review queues; audit third-party extension trust and Nerd Font/UI assumptions before default rollout.",
      "evidence": [
        {
          "type": "official_repo",
          "url": "https://github.com/dlvhdr/gh-dash"
        }
      ]
    },
    {
      "id": "gh-stack",
      "name": "gh-stack",
      "repo": "github/gh-stack",
      "url": "https://github.com/github/gh-stack",
      "kind": "gh-extension",
      "category_id": "gh-extensions",
      "category": "gh Extensions",
      "summary": "GitHub extension for stacked branches and stacked pull requests, including agent-facing skill guidance.",
      "ratings": {
        "agent": "medium",
        "human": "high",
        "risk": "high",
        "status": "watch"
      },
      "install": {
        "display": "gh extension install github/gh-stack",
        "methods": [
          {
            "kind": "gh-extension",
            "command": "gh extension install github/gh-stack"
          }
        ]
      },
      "practical": {
        "best_for": [
          "stacked-prs",
          "branch-stacks",
          "team-evaluation"
        ],
        "daily_use": "not_default",
        "agent_use": "Evaluate only for teams that explicitly run stacked PR workflows with review boundaries.",
        "human_use": "Use when a team has adopted stacked pull requests and understands the extension workflow.",
        "cautious_start": "Try in a sandbox repository before using it on production branches.",
        "guardrails": [
          "sandbox-repo",
          "human-approval"
        ],
        "pairs_with": [
          {
            "tool_id": "github-cli",
            "reason": "Use gh for direct PR readback and fallback operations.",
            "combined_risk": "high"
          }
        ]
      },
      "notes": "Preview-oriented stacked PR workflow; use only when stacked PRs are enabled and the team's auth model supports the extension.",
      "evidence": [
        {
          "type": "official_repo",